Part,Type,Quantity,Price,Link,Status,Notes
MPU-6050,IMU,1,₹169.00,Buy MPU-6050 3-Axis Accelerometer and Gyro Sensor at Best Price,In stock,
GA12-N20,Motor,2,₹239.00,Buy N20-6V-200 RPM Micro Metal Gear-box DC Motor Online at Robu.inc-motor-2/,Out of stock,
ESP32,MCU,1,₹257.00,ESP32-C3 Development Board with Solderingring/,In stock,
TB6612FNG,Motor Driver,1,₹161.00,Buy Dual Motor Driver Module 1A TB6612FNG For Arduino Microcontroller,In stock,
2s LiPo,Battery,1,₹781.00,Buy Bonka 7.4V 600mAh 45C 2S Lithium Polymer Battery Pack at Best Price,Out of stock,
LM2596,Buck Converter,1,₹41.00,LM2596S DC-DC Buck Converter Power Supply,In stock,
Groove Coupler,Encoder,2,₹38.00,Speed Measuring Sensor Groove Coupler Module For Arduino,Out of stock,
Total,Sum,7,"₹1,963.00",N/A,Sum,