Part,Type,Quantity,Price,Link,Status,Notes
MPU-6050,IMU,1,₹169.00,https://robu.in/product/mpu-6050-gyro-sensor-2-accelerometer/,In stock,Most standard and cost efficient option available
GA12-N20,Motor,2,₹239.00,https://robu.in/product/n20-6v-100-rpm-micro-metal-gear-box-dc-motor-2/,In stock,Provides enough torque and rpm to balance the robot
ESP32,MCU,1,₹257.00,https://robu.in/product/esp32-c3-development-board-with-soldering/,In stock,Has excess processing power to handle the PID loop
TB6612FNG,Motor Driver,1,₹161.00,https://robu.in/product/motor-driver-tb6612fng-module-performance-ultra-small-volume-3-pi-matching-performance-ultra-l298n/,In stock,Very efficient motor driver
2S1P Li-Ion,Battery,1,₹576.00,https://robu.in/product/18650-li-ion-2200mah-7-4v-2s1p-protected-battery-pack-2c/,In stock,"Standard choice, sufficient to power all our components"
LM2596,Buck Converter,1,₹41.00,https://robu.in/product/lm2596s-dc-dc-buck-converter-power-supply/,In stock,Buck converter required to step down battery voltage to use with ESP
Photoelectric Sensor,Encoder,2,₹66.00,https://robu.in/product/correlation-photoelectric-infrared-count-sensor-module/#tab-description,In stock,Groove Coupler acts as a motor encoder to calculate motor RPM
Total,Sum,9,"₹1,814.00",N/A,Sum,Overall these parts are expected to work well together